{
  "eventId": "evt_customerupdated_001",
  "eventType": "CustomerUpdated",
  "schemaVersion": 1,
  "occurredAt": "2026-08-10T02:00:00Z",
  "publishedAt": "2026-08-10T02:00:01Z",
  "producer": "SYS-04",
  "environment": "DEV",
  "audience": [
    "SYS-01",
    "SYS-06"
  ],
  "enterpriseId": "ent_contract_001",
  "aggregateType": "Customer",
  "aggregateId": "cus_contract_001",
  "aggregateVersion": 3,
  "traceId": "trace_contract_fixture_001",
  "causationId": null,
  "correlationId": "corr_contract_fixture_001",
  "idempotencyKey": "CRM_CUSTOMER:cus_contract_001:3",
  "payload": {
    "customerId": "cus_contract_001",
    "enterpriseId": "ent_contract_001",
    "mainStage": "OPPORTUNITY",
    "globalRefusalStatus": "NONE",
    "ownerId": "usr_contract_002",
    "customerVersion": 3,
    "analyticsSnapshotRef": "mas_contract_customer_003",
    "analyticsSnapshotVersion": 3,
    "analyticsSnapshotHash": "9999999999999999999999999999999999999999999999999999999999999999",
    "updatedAt": "2026-08-10T02:00:00Z"
  }
}
